{
  "id": "g_partial_bad",
  "pack_version": "0.1.0",
  "profile_id": "fitpac.prose_compiler.compiler_profile_v0",
  "doc_ref": "doc://fixture/partial",
  "compiler_grade_ready": true,
  "nodes": [
    {
      "id": "n1",
      "kind": "spine_primitive",
      "draft": false,
      "ontology_primitive_id": "Constraint.must_hold",
      "compiler_grade_ready": true
    }
  ],
  "edges": [],
  "resolution_artifacts": [],
  "normalized_obligations": [
    {
      "id": "norm1",
      "frame_id": "f1",
      "doc_ref": "doc://fixture/partial",
      "normalization_status": "resolved",
      "polarity": "affirm",
      "binding_slots": {
        "action_sense_id": "act.must_provide",
        "actor_normalized": "actor.system",
        "object_kind": "entity_kind.api_response",
        "object_entity_id": null
      }
    }
  ],
  "binding_outcomes": [
    {
      "id": "bo1",
      "outcome": "partial",
      "normalized_obligation_id": "norm1",
      "ontology_primitive_id": null,
      "telemetry": { "failure_mode": "unknown_action_sense" }
    }
  ]
}
